{
  "$schema": "https://json-schema.org/draft/2020-12/schema",
  "$id": "urn:aces-scenario-pack:schema:release:v0",
  "version": "0.1.0",
  "title": "ACES Scenario Pack — Release Metadata (v0)",
  "description": "Release metadata for a pack: the release version, the schema versions it publishes, the compatibility impact, and migration notes. Follows the versioning and release policy in docs/versioning.md.",
  "type": "object",
  "required": ["packId", "releaseVersion", "compatibilityImpact"],
  "properties": {
    "packId": {"type": "string", "description": "Pack this release record applies to."},
    "releaseVersion": {"type": "string", "description": "Release version (SemVer, tagged vMAJOR.MINOR.PATCH)."},
    "schemaVersions": {
      "type": "array",
      "description": "Schema families published in this release and their versions.",
      "items": {
        "type": "object",
        "required": ["family", "version"],
        "properties": {
          "family": {"type": "string", "description": "Schema family key (see schemas/index.json)."},
          "version": {"type": "string", "description": "Published version of the family."}
        }
      }
    },
    "compatibilityImpact": {
      "type": "object",
      "required": ["level"],
      "properties": {
        "level": {
          "type": "string",
          "enum": ["none", "additive", "breaking"],
          "description": "Compatibility impact of this release."
        },
        "notes": {"type": "string", "description": "What changed and why, in compatibility terms."}
      }
    },
    "migrationNotes": {"type": "string", "description": "Migration story for any breaking change."}
  }
}
